note_id,related_type,related_id,note_date,status,next_action,notes
N001,vendor,V001,2025-05-01,Watch,Map Navy incumbency,"Apex has repeated Navy wins and may need niche analytics partners."
N002,opportunity,O002,2025-05-06,Research,Review RFI language,"Strong fit for RAG and knowledge-management experience."
N003,award,A010,2025-05-12,Contact,Identify Team Submarine stakeholders,"Contract ends within 12 months; useful early outreach window."
N004,vendor,V006,2025-05-19,Watch,Assess competitor or partner fit,"Small business with cyber analytics wins could be partner or competitor."
N005,opportunity,O009,2025-06-05,Pursue,Draft capability statement,"Decision support and acquisition analytics are high-alignment keywords."
N006,vendor,V011,2025-06-06,Research,Find subcontracting contacts,"Large DISA cloud prime with likely specialist subcontractor needs."
